player_id,player_name,team_id,position,scoring_format,include_in_rankings,games_projected,targets,receptions,receiving_yards,receiving_tds,carries,rushing_yards,rushing_tds,pass_attempts,passing_yards,passing_tds,interceptions,fumbles_lost,raw_projected_fantasy_points,manual_fantasy_point_adjustment,final_projected_fantasy_points,overall_rank,position_rank,analyst_tag,analyst_note
joe-burrow,Joe Burrow,CIN,QB,half_ppr,True,17.0,0.0,0.0,0.0,0.0,0.0,0.0,0.0,658.0,4442.0,35.0,16.0,0.0,285.68,0.0,285.68,,,core,Primary Bengals passer baseline.
jamarr-chase,Ja'Marr Chase,CIN,WR,half_ppr,True,17.0,187.5,127.5,1800.3,12.2,0.0,0.0,0.0,0.0,0.0,0.0,0.0,0.0,317.29,0.0,317.29,,,target,Elite target share in concentrated offense.
tee-higgins,Tee Higgins,CIN,WR,half_ppr,True,16.0,144.8,94.1,1302.8,8.8,0.0,0.0,0.0,0.0,0.0,0.0,0.0,0.0,229.83,0.0,229.83,,,target,High-value secondary alpha.
mike-gesicki,Mike Gesicki,CIN,TE,half_ppr,True,17.0,72.4,47.8,564.6,3.5,0.0,0.0,0.0,0.0,0.0,0.0,0.0,0.0,101.34,0.0,101.34,,,watch,Usable receiving tight end bucket.
chase-brown,Chase Brown,CIN,RB,half_ppr,True,17.0,65.8,51.3,408.0,2.1,239.1,1004.3,6.3,0.0,0.0,0.0,0.0,0.0,217.29,0.0,217.29,,,target,Lead back workload assumption.
cin-other-wr-te,CIN Other WR/TE,CIN,OTHER,half_ppr,False,17.0,134.9,80.9,944.2,7.0,0.0,0.0,0.0,0.0,0.0,0.0,0.0,0.0,176.89,0.0,176.89,,,bucket,Receiving reconciliation bucket.
cin-other-rb-targets,CIN Other RB Targets,CIN,OTHER,half_ppr,False,17.0,52.6,37.9,289.5,1.4,0.0,0.0,0.0,0.0,0.0,0.0,0.0,0.0,56.3,0.0,56.3,,,bucket,RB receiving reconciliation bucket.
cin-other-rushing,CIN Other Rushing,CIN,OTHER,half_ppr,False,17.0,0.0,0.0,0.0,0.0,187.9,751.5,7.7,0.0,0.0,0.0,0.0,0.0,121.35,0.0,121.35,,,bucket,Rushing reconciliation bucket.
jordan-love,Jordan Love,GB,QB,half_ppr,True,17.0,0.0,0.0,0.0,0.0,46.3,198.9,0.5,535.0,4118.0,27.0,9.0,2.0,273.85,0.0,273.85,,,core,Efficient passer gets modest pass-volume bump; small rushing contribution included.
josh-jacobs,Josh Jacobs,GB,RB,half_ppr,True,16.0,48.1,37.6,308.2,1.1,257.0,1028.0,12.1,0.0,0.0,0.0,0.0,1.0,229.23,0.0,229.23,,,core,"Lead back remains TD engine, but pass-rate bump trims rush share slightly."
emanuel-wilson,Emanuel Wilson,GB,RB,half_ppr,True,17.0,18.7,14.0,108.6,0.3,102.8,421.5,2.5,0.0,0.0,0.0,0.0,0.0,76.77,0.0,76.77,,,watch,Primary backup baseline with usable injury contingent value.
marshawn-lloyd,MarShawn Lloyd,GB,RB,half_ppr,True,15.0,13.4,10.0,80.2,0.3,51.4,226.2,0.9,0.0,0.0,0.0,0.0,0.0,42.68,0.0,42.68,,,watch,Explosive depth back assumption; role depends on health and camp usage.
christian-watson,Christian Watson,GB,WR,half_ppr,True,16.0,101.7,63.0,1067.3,5.9,0.0,0.0,0.0,0.0,0.0,0.0,0.0,0.0,173.88,0.0,173.88,,,target,Primary outside ceiling bet after Doubs/Wicks departures; health risk remains.
jayden-reed,Jayden Reed,GB,WR,half_ppr,True,16.0,107.0,72.8,920.2,4.9,15.4,107.9,0.2,0.0,0.0,0.0,0.0,0.0,169.43,0.0,169.43,,,target,Extension plus vacated targets support rebound from injury-shortened 2025.
matthew-golden,Matthew Golden,GB,WR,half_ppr,True,17.0,91.0,57.3,800.4,4.3,10.3,51.4,0.2,0.0,0.0,0.0,0.0,0.0,140.83,0.0,140.83,,,target,Former first-round receiver gets expanded role after uneven rookie year.
tucker-kraft,Tucker Kraft,GB,TE,half_ppr,True,14.0,69.5,50.1,681.6,4.3,0.0,0.0,0.0,0.0,0.0,0.0,0.0,0.0,119.12,0.0,119.12,,,watch,"Excellent 2025 efficiency, but ACL rehab lowers games and early-season certainty."
luke-musgrave,Luke Musgrave,GB,TE,half_ppr,True,17.0,37.5,25.5,292.1,1.6,0.0,0.0,0.0,0.0,0.0,0.0,0.0,0.0,51.66,0.0,51.66,,,watch,More useful if Kraft limited; otherwise secondary TE receiving bucket.
savion-williams,Savion Williams,GB,WR,half_ppr,True,17.0,29.4,17.7,220.7,1.4,10.3,46.3,0.2,0.0,0.0,0.0,0.0,0.0,44.7,0.0,44.7,,,watch,Gadget/size role grows with receiver room turnover.
gb-other-wr-te,GB Other WR/TE,GB,OTHER,half_ppr,False,17.0,18.7,11.2,131.1,3.0,0.0,0.0,0.0,0.0,0.0,0.0,0.0,0.0,36.55,0.0,36.55,,,bucket,Receiving reconciliation bucket for remaining WR/TE/RB targets.
gb-other-rushing,GB Other Rushing,GB,OTHER,half_ppr,False,17.0,0.0,0.0,0.0,0.0,20.6,82.2,1.4,0.0,0.0,0.0,0.0,0.0,16.86,0.0,16.86,,,bucket,Rushing reconciliation bucket.
jacoby-brissett,Jacoby Brissett,ARI,QB,half_ppr,True,14.0,0.0,0.0,0.0,0.0,17.9,66.2,0.6,587.0,3449.6,21.1,10.6,2.0,207.8,0.0,207.8,,,watch,Reported 2026 starter; volume useful but ceiling capped on rebuilding offense.
carson-beck,Carson Beck,ARI,QB,half_ppr,True,5.0,0.0,0.0,0.0,0.0,8.9,31.3,0.2,80.0,470.4,2.9,1.4,1.0,29.55,0.0,29.55,,,watch,Developmental rookie path if Cardinals evaluate late-season future.
jeremiyah-love,Jeremiyah Love,ARI,RB,half_ppr,True,17.0,60.0,44.4,384.2,1.7,187.7,863.6,7.2,0.0,0.0,0.0,0.0,1.0,198.27,0.0,198.27,,,target,First-round rookie RB with three-down profile in LaFleur run/play-action reset.
james-conner,James Conner,ARI,RB,half_ppr,True,14.0,33.4,25.0,186.8,1.0,89.4,366.5,3.2,0.0,0.0,0.0,0.0,0.0,92.8,0.0,92.8,,,watch,Veteran role trimmed by Jeremiyah Love but still short-yardage/rotation relevant.
tyler-allgeier,Tyler Allgeier,ARI,RB,half_ppr,True,17.0,13.3,9.3,66.7,0.2,71.5,286.1,2.4,0.0,0.0,0.0,0.0,0.0,55.79,0.0,55.79,,,watch,Depth/committee grinder behind Love and Conner.
trey-benson,Trey Benson,ARI,RB,half_ppr,True,12.0,0.0,0.0,0.0,0.0,35.8,146.6,1.0,0.0,0.0,0.0,0.0,0.0,20.42,0.0,20.42,,,watch,Former depth back squeezed by Love addition but retains contingent upside.
trey-mcbride,Trey McBride,ARI,TE,half_ppr,True,17.0,166.8,121.7,1300.6,6.7,0.0,0.0,0.0,0.0,0.0,0.0,0.0,0.0,231.25,0.0,231.25,,,core,Elite target earner remains offensive centerpiece after 2025 TE1-level usage.
marvin-harrison-jr,Marvin Harrison Jr.,ARI,WR,half_ppr,True,16.0,140.1,86.8,1288.6,5.3,0.0,0.0,0.0,0.0,0.0,0.0,0.0,0.0,203.97,0.0,203.97,,,target,Health rebound and new staff support WR1 target growth.
michael-wilson,Michael Wilson,ARI,WR,half_ppr,True,17.0,120.1,75.6,1008.5,4.3,0.0,0.0,0.0,0.0,0.0,0.0,0.0,0.0,164.59,0.0,164.59,,,target,Reliable 2025 producer remains high-snap outside/slot option.
kendrick-bourne,Kendrick Bourne,ARI,WR,half_ppr,True,16.0,53.4,35.2,416.2,1.9,0.0,0.0,0.0,0.0,0.0,0.0,0.0,0.0,70.75,0.0,70.75,,,watch,Veteran receiver addition gives Brissett a steady secondary target.
elijah-higgins,Elijah Higgins,ARI,TE,half_ppr,True,17.0,26.7,18.7,186.8,1.0,0.0,0.0,0.0,0.0,0.0,0.0,0.0,0.0,33.77,0.0,33.77,,,watch,Secondary TE in McBride-heavy room.
ari-other-wr-te,ARI Other WR/TE,ARI,OTHER,half_ppr,False,17.0,53.4,32.0,373.5,1.9,0.0,0.0,0.0,0.0,0.0,0.0,0.0,0.0,64.88,0.0,64.88,,,bucket,Receiving reconciliation bucket for remaining receivers/tight ends.
ari-other-rushing,ARI Other Rushing,ARI,OTHER,half_ppr,False,17.0,0.0,0.0,0.0,0.0,35.8,143.0,1.4,0.0,0.0,0.0,0.0,0.0,22.94,0.0,22.94,,,bucket,Rushing reconciliation bucket.
tua-tagovailoa,Tua Tagovailoa,ATL,QB,half_ppr,True,12.0,0.0,0.0,0.0,0.0,10.4,32.3,0.4,355.9,2368.4,14.9,6.8,1.0,144.01,0.0,144.01,,,watch,Veteran bridge/competition QB after Falcons signing; efficient if starting but role not locked.
michael-penix-jr,Michael Penix Jr.,ATL,QB,half_ppr,True,8.0,0.0,0.0,0.0,0.0,10.4,33.3,0.5,218.1,1451.6,9.1,4.2,1.0,90.76,0.0,90.76,,,watch,ACL rehab creates uncertain early-season role but arm talent remains.
bijan-robinson,Bijan Robinson,ATL,RB,half_ppr,True,17.0,97.6,74.2,751.4,3.4,281.3,1322.3,10.4,0.0,0.0,0.0,0.0,1.0,325.25,0.0,325.25,,,core,Elite dual-threat back remains centerpiece in Stefanski/Callahan run-friendly setup.
brian-robinson,Brian Robinson,ATL,RB,half_ppr,True,17.0,14.4,10.3,77.5,0.2,99.0,396.0,3.6,0.0,0.0,0.0,0.0,0.0,75.55,0.0,75.55,,,watch,Power complement behind Bijan; touchdown role depends on game script.
tyler-goodson,Tyler Goodson,ATL,RB,half_ppr,True,17.0,0.0,0.0,0.0,0.0,31.3,128.2,0.9,0.0,0.0,0.0,0.0,0.0,18.22,0.0,18.22,,,watch,Depth rushing bucket with contingent value.
drake-london,Drake London,ATL,WR,half_ppr,True,16.0,143.5,90.4,1348.9,6.5,0.0,0.0,0.0,0.0,0.0,0.0,0.0,0.0,218.97,0.0,218.97,,,target,Clear WR1 after Mooney release; QB volatility only real limiter.
kyle-pitts,Kyle Pitts Sr.,ATL,TE,half_ppr,True,17.0,114.8,80.4,1010.2,5.3,0.0,0.0,0.0,0.0,0.0,0.0,0.0,0.0,172.88,0.0,172.88,,,target,Franchise-tagged focal point after leading 2025 receiving yardage.
jahan-dotson,Jahan Dotson,ATL,WR,half_ppr,True,17.0,63.1,39.1,517.7,2.4,0.0,0.0,0.0,0.0,0.0,0.0,0.0,0.0,85.75,0.0,85.75,,,watch,Free-agent receiver fills Mooney vacancy but target ceiling capped by London/Pitts/Bijan.
olamide-zaccheaus,Olamide Zaccheaus,ATL,WR,half_ppr,True,17.0,40.2,25.7,305.4,1.4,0.0,0.0,0.0,0.0,0.0,0.0,0.0,0.0,52.03,0.0,52.03,,,watch,Familiar depth receiver baseline in thin WR room.
austin-hooper,Austin Hooper,ATL,TE,half_ppr,True,17.0,23.0,15.6,156.1,1.0,0.0,0.0,0.0,0.0,0.0,0.0,0.0,0.0,29.18,0.0,29.18,,,watch,Veteran TE2 depth behind Pitts.
atl-other-wr-te,ATL Other WR/TE,ATL,OTHER,half_ppr,False,17.0,77.5,44.9,542.4,3.8,0.0,0.0,0.0,0.0,0.0,0.0,0.0,0.0,99.76,0.0,99.76,,,bucket,Receiving reconciliation bucket for remaining WR/TE targets.
atl-other-rushing,ATL Other Rushing,ATL,OTHER,half_ppr,False,17.0,0.0,0.0,0.0,0.0,88.6,354.3,2.2,0.0,0.0,0.0,0.0,0.0,48.39,0.0,48.39,,,bucket,Rushing reconciliation bucket.
lamar-jackson,Lamar Jackson,BAL,QB,half_ppr,True,17.0,0.0,0.0,0.0,0.0,127.2,763.1,9.0,462.0,3450.0,23.0,10.0,2.0,336.31,0.0,336.31,,,core,Lamar remains the full offense; rushing keeps elite fantasy floor despite new OC.
derrick-henry,Derrick Henry,BAL,RB,half_ppr,True,16.0,16.2,11.6,88.9,0.2,237.8,1212.7,11.5,0.0,0.0,0.0,0.0,1.0,204.37,0.0,204.37,,,core,Still lead hammer in league-best rushing ecosystem; age and OL change add risk.
justice-hill,Justice Hill,BAL,RB,half_ppr,True,17.0,27.7,21.1,166.3,0.5,60.8,273.7,1.5,0.0,0.0,0.0,0.0,0.0,66.3,0.0,66.3,,,watch,Passing-down/changeup role with contingent value.
rasheen-ali,Rasheen Ali,BAL,RB,half_ppr,True,17.0,6.9,4.9,34.6,0.2,33.2,142.7,0.8,0.0,0.0,0.0,0.0,0.0,26.04,0.0,26.04,,,watch,Depth back behind Henry/Hill.
zay-flowers,Zay Flowers,BAL,WR,half_ppr,True,16.0,115.5,79.7,1062.6,4.8,5.5,38.7,0.2,0.0,0.0,0.0,0.0,0.0,180.46,0.0,180.46,,,target,Primary target earner in low-volume but efficient passing offense.
rashod-bateman,Rashod Bateman,BAL,WR,half_ppr,True,16.0,73.9,45.8,702.2,3.7,0.0,0.0,0.0,0.0,0.0,0.0,0.0,0.0,115.22,0.0,115.22,,,watch,Outside starter with volatile weekly target volume.
deandre-hopkins,DeAndre Hopkins,BAL,WR,half_ppr,True,15.0,50.8,31.5,426.9,2.8,0.0,0.0,0.0,0.0,0.0,0.0,0.0,0.0,75.0,0.0,75.0,,,watch,Veteran red-zone/possession role if roster spot and snaps hold.
mark-andrews,Mark Andrews,BAL,TE,half_ppr,True,17.0,83.2,56.5,665.3,5.1,0.0,0.0,0.0,0.0,0.0,0.0,0.0,0.0,125.16,0.0,125.16,,,target,TE room departures can consolidate high-value targets back to Andrews.
devontez-walker,Devontez Walker,BAL,WR,half_ppr,True,17.0,25.4,14.7,223.6,1.6,0.0,0.0,0.0,0.0,0.0,0.0,0.0,0.0,39.39,0.0,39.39,,,watch,Vertical depth role competing with rookie WRs.
jakobi-lane,Ja'Kobi Lane,BAL,WR,half_ppr,True,17.0,20.8,11.6,170.5,1.2,0.0,0.0,0.0,0.0,0.0,0.0,0.0,0.0,29.77,0.0,29.77,,,watch,Rookie contested-catch option with possible red-zone role.
bal-other-wr-te,BAL Other WR/TE,BAL,OTHER,half_ppr,False,17.0,41.6,24.1,291.1,3.0,0.0,0.0,0.0,0.0,0.0,0.0,0.0,0.0,59.1,0.0,59.1,,,bucket,Receiving reconciliation bucket for remaining WR/TE/RB targets.
bal-other-rushing,BAL Other Rushing,BAL,OTHER,half_ppr,False,17.0,0.0,0.0,0.0,0.0,88.5,398.2,2.0,0.0,0.0,0.0,0.0,0.0,51.82,0.0,51.82,,,bucket,Rushing reconciliation bucket.
josh-allen,Josh Allen,BUF,QB,half_ppr,True,17.0,0.0,0.0,0.0,0.0,117.2,597.6,12.6,558.0,4100.0,30.0,10.0,2.0,395.36,0.0,395.36,,,core,Elite dual-threat QB retains overall QB1 path in Brady offense.
james-cook,James Cook,BUF,RB,half_ppr,True,16.0,33.5,25.1,214.3,0.9,256.7,1206.4,9.2,0.0,0.0,0.0,0.0,1.0,213.46,0.0,213.46,,,core,Rushing champ regression baked in but still lead back in elite run game.
ray-davis,Ray Davis,BUF,RB,half_ppr,True,17.0,14.0,10.0,75.3,0.3,83.7,343.2,2.8,0.0,0.0,0.0,0.0,0.0,65.47,0.0,65.47,,,watch,Primary power/relief back behind Cook.
ty-johnson,Ty Johnson,BUF,RB,half_ppr,True,17.0,27.9,21.2,181.4,0.6,33.5,144.0,0.8,0.0,0.0,0.0,0.0,0.0,51.77,0.0,51.77,,,watch,Passing-down/changeup role retains some spike-week value.
khalil-shakir,Khalil Shakir,BUF,WR,half_ppr,True,17.0,106.0,76.3,869.4,4.8,0.0,0.0,0.0,0.0,0.0,0.0,0.0,0.0,153.9,0.0,153.9,,,target,Most stable WR target earner in spread-out Bills passing game.
dalton-kincaid,Dalton Kincaid,BUF,TE,half_ppr,True,16.0,100.4,70.3,843.7,5.1,0.0,0.0,0.0,0.0,0.0,0.0,0.0,0.0,150.12,0.0,150.12,,,target,Health rebound gives him TE1 usage upside.
keon-coleman,Keon Coleman,BUF,WR,half_ppr,True,17.0,78.1,45.3,718.7,4.5,0.0,0.0,0.0,0.0,0.0,0.0,0.0,0.0,121.53,0.0,121.53,,,watch,Big-bodied second-year receiver with role but uneven separation profile.
brandin-cooks,Brandin Cooks,BUF,WR,half_ppr,True,15.0,55.8,33.5,502.2,2.7,0.0,0.0,0.0,0.0,0.0,0.0,0.0,0.0,83.16,0.0,83.16,,,watch,Veteran field-stretcher role after free-agent addition.
gabe-davis,Gabe Davis,BUF,WR,half_ppr,True,14.0,44.6,25.4,424.1,2.7,0.0,0.0,0.0,0.0,0.0,0.0,0.0,0.0,71.33,0.0,71.33,,,watch,Boom/bust depth receiver if health cooperates.
dawson-knox,Dawson Knox,BUF,TE,half_ppr,True,17.0,33.5,22.1,244.4,2.4,0.0,0.0,0.0,0.0,0.0,0.0,0.0,0.0,49.89,0.0,49.89,,,watch,TD-dependent TE2 in two-TE packages.
skyler-bell,Skyler Bell,BUF,WR,half_ppr,True,17.0,19.5,11.3,156.2,0.9,0.0,0.0,0.0,0.0,0.0,0.0,0.0,0.0,26.69,0.0,26.69,,,watch,Day-three rookie separator with modest first-year role.
buf-other-wr-te,BUF Other WR/TE,BUF,OTHER,half_ppr,False,17.0,44.6,25.9,312.5,5.1,0.0,0.0,0.0,0.0,0.0,0.0,0.0,0.0,74.79,0.0,74.79,,,bucket,Receiving reconciliation bucket for remaining WR/TE/RB targets.
buf-other-rushing,BUF Other Rushing,BUF,OTHER,half_ppr,False,17.0,0.0,0.0,0.0,0.0,67.0,287.9,2.5,0.0,0.0,0.0,0.0,0.0,43.91,0.0,43.91,,,bucket,Rushing reconciliation bucket.
